{
  "_type": "suderra.result.v1",
  "occurred_at": "2026-10-20T11:20:00Z",
  "time_state": "synced-nts",
  "board_profile": "revpi-connect4",
  "os_version": "1.0.0",
  "seq": 21,
  "kind": "lockdown",
  "outcome": "failed",
  "reason": "lifecycle-inconsistent",
  "subject": {
    "lifecycle_to": "LOCKED"
  }
}
