{
  "_type": "suderra.result.v1",
  "occurred_at": "2026-10-20T11:20:00Z",
  "time_state": "synced-nts",
  "board_profile": "revpi-connect4",
  "os_version": "1.0.0",
  "seq": 6,
  "kind": "edge-update",
  "outcome": "ok",
  "subject": {
    "version": "1.7.0",
    "security_version": 7,
    "statement_type": "suderra.edge-update.v1",
    "statement_digest": {
      "sha256": "a1dacec3cd53bfe4f236598615b106baf6456027d7631874c0b02cc145400416"
    },
    "update_seq": 4
  }
}
