{
  "_type": "suderra.result.v1",
  "occurred_at": "2026-10-20T11:20:00Z",
  "time_state": "synced-nts",
  "board_profile": "revpi-connect4",
  "os_version": "1.0.0",
  "seq": 3,
  "kind": "verify-current",
  "outcome": "rejected",
  "reason": "site-file-digest-mismatch",
  "subject": {
    "statement_type": "suderra.site-config.v1",
    "update_seq": 2
  },
  "detail": "config.yaml differs from the install receipt; reload refused"
}
