{
  "_type": "suderra.result.v1",
  "occurred_at": "2026-10-20T11:20:00Z",
  "time_state": "synced-nts",
  "board_profile": "revpi-connect4",
  "os_version": "1.0.0",
  "seq": 3,
  "kind": "lifecycle",
  "outcome": "ok",
  "subject": {
    "lifecycle_from": "PROVISIONING",
    "lifecycle_to": "ACTIVE"
  }
}
