{
  "_type": "suderra.result.v1",
  "occurred_at": "2026-10-20T11:20:00Z",
  "time_state": "synced-nts",
  "board_profile": "revpi-connect4",
  "os_version": "1.0.0",
  "seq": 14,
  "kind": "site-config",
  "outcome": "rejected",
  "reason": "site-bundle-missing",
  "subject": {
    "statement_type": "suderra.site-config.v1",
    "statement_digest": {
      "sha256": "7006986e1c1f7a00de0054a68c2a4af594cb84070de7ca5d3d964189e0e818c2"
    },
    "update_seq": 3
  }
}
