{
  "_type": "suderra.result.v1",
  "occurred_at": "2026-10-20T11:20:00Z",
  "time_state": "synced-nts",
  "board_profile": "revpi-connect4",
  "os_version": "1.0.0",
  "seq": 20,
  "kind": "lockdown",
  "outcome": "failed",
  "reason": "provisioning-mode-active",
  "detail": "the one-time-password shadow is still bound over /etc/shadow"
}
